{
  "schemaVersion": "provia-project/v1.1",
  "project": {
    "key": "admissao-exemplo",
    "title": "Admissão de trabalhador — exemplo",
    "language": "pt-AO",
    "country": "Angola",
    "timezone": "Africa/Luanda",
    "currency": "AOA",
    "generator": "provia-skills/1.3.0",
    "contractRevision": "fed8efaf019abc901cb2b229f3676dc4031126fa",
    "updatedAt": "2026-10-17"
  },
  "organization": {
    "name": "Empresa de demonstração",
    "sector": "Serviços",
    "mode": "disconnected",
    "tenantId": null,
    "productRevision": null
  },
  "sources": [
    {
      "id": "sop-admissao",
      "title": "Procedimento de admissão (sintético)",
      "kind": "sop",
      "version": "1",
      "effectiveDate": null,
      "sections": [
        {
          "anchor": "1",
          "title": "Aprovação e dados"
        },
        {
          "anchor": "2",
          "title": "Acessos e equipamento"
        },
        {
          "anchor": "3",
          "title": "Acolhimento"
        },
        {
          "anchor": "4",
          "title": "Fecho administrativo"
        }
      ]
    }
  ],
  "entityTypes": [],
  "groups": [
    {
      "key": "rh",
      "name": "Recursos Humanos",
      "parentKey": null,
      "purpose": "Confirmam a aprovação, os dados e o fecho administrativo da admissão.",
      "members": [
        {
          "role": "Técnico de Recursos Humanos",
          "email": null
        }
      ],
      "sourceRefs": [
        {
          "source": "sop-admissao",
          "section": "1"
        },
        {
          "source": "sop-admissao",
          "section": "4"
        }
      ],
      "flags": [],
      "kind": "team",
      "area": "capital_humano"
    },
    {
      "key": "ti",
      "name": "Suporte de TI",
      "parentKey": null,
      "purpose": "Preparam acessos e equipamento.",
      "members": [
        {
          "role": "Técnico de suporte",
          "email": null
        }
      ],
      "sourceRefs": [
        {
          "source": "sop-admissao",
          "section": "2"
        }
      ],
      "flags": [],
      "kind": "team",
      "area": "capital_humano"
    },
    {
      "key": "chefias",
      "name": "Chefias de departamento",
      "parentKey": null,
      "purpose": "Recebem a pessoa no primeiro dia.",
      "members": [
        {
          "role": "Chefe de departamento",
          "email": null
        }
      ],
      "sourceRefs": [
        {
          "source": "sop-admissao",
          "section": "3"
        }
      ],
      "flags": [],
      "kind": "team",
      "area": "capital_humano"
    }
  ],
  "workflows": [
    {
      "key": "admissao",
      "name": "Admissão de trabalhador — exemplo",
      "prefix": "ADM",
      "file": "workflow.yaml",
      "status": "validated",
      "sourceRefs": [
        {
          "source": "sop-admissao"
        }
      ],
      "actions": [
        {
          "localId": "confirmar_dados",
          "name": "Confirmar os dados aprovados",
          "type": "standard",
          "sourceRefs": [
            {
              "source": "sop-admissao",
              "section": "1"
            }
          ],
          "assigneeRef": "rh",
          "formRef": null,
          "entityRefs": [],
          "evidence": [
            "Aprovação anexada",
            "Comentário a confirmar os campos"
          ],
          "due": {
            "offsetDays": 2,
            "offsetType": "workdays",
            "basis": "activation"
          },
          "folded": [
            {
              "section": "1",
              "summary": "A chefia é consultada sobre data, função e departamento dentro desta acção."
            }
          ]
        },
        {
          "localId": "preparar_acessos",
          "name": "Preparar acessos e equipamento",
          "type": "standard",
          "sourceRefs": [
            {
              "source": "sop-admissao",
              "section": "2"
            }
          ],
          "assigneeRef": "ti",
          "formRef": null,
          "entityRefs": [],
          "evidence": [
            "Comentário com acessos e equipamento"
          ],
          "due": {
            "offsetDays": 3,
            "offsetType": "workdays",
            "basis": "activation"
          },
          "folded": []
        },
        {
          "localId": "acolher",
          "name": "Realizar o acolhimento",
          "type": "standard",
          "sourceRefs": [
            {
              "source": "sop-admissao",
              "section": "3"
            }
          ],
          "assigneeRef": "chefias",
          "formRef": null,
          "entityRefs": [],
          "evidence": [
            "Lista de verificação de acolhimento assinada"
          ],
          "due": {
            "offsetDays": 1,
            "offsetType": "workdays",
            "basis": "activation"
          },
          "folded": [
            {
              "section": "3",
              "summary": "Entrega do equipamento e verificação dos acessos fazem parte do acolhimento."
            }
          ]
        },
        {
          "localId": "confirmar_conclusao",
          "name": "Confirmar a conclusão",
          "type": "standard",
          "sourceRefs": [
            {
              "source": "sop-admissao",
              "section": "4"
            }
          ],
          "assigneeRef": "rh",
          "formRef": null,
          "entityRefs": [],
          "evidence": [
            "Comentário com as três verificações e datas"
          ],
          "due": {
            "offsetDays": 5,
            "offsetType": "workdays",
            "basis": "activation"
          },
          "folded": [
            {
              "section": "4",
              "summary": "Segurança social e processamento salarial são confirmados junto de quem os trata; não são acções separadas."
            }
          ]
        }
      ],
      "subWorkflowRefs": [],
      "setupNotes": [
        "O YAML de formação atribui todas as acções ao criador; os responsáveis pretendidos são os grupos deste manifesto.",
        "Este exemplo não enumera obrigações laborais angolanas; confirmar os documentos exigidos com fontes verificadas.",
        "Os prazos são ilustrativos. O prazo do acolhimento conta a partir da activação da acção, não da data de início."
      ],
      "ownerArea": "capital_humano",
      "access": {
        "grants": [
          {
            "grantee": "group:rh",
            "level": "create_incident",
            "reason": "Os Recursos Humanos abrem o caso de admissão depois da aprovação da contratação",
            "sourceRefs": [
              {
                "source": "sop-admissao",
                "section": "1"
              }
            ]
          }
        ],
        "sensitivity": "restricted",
        "note": "Dados pessoais do trabalhador: TI e chefias vêem apenas os casos com as suas acções; quem abre (RH) vê todos os casos do workflow (limitação registada em decisions[])"
      }
    }
  ],
  "forms": [],
  "aiProfiles": [],
  "decisions": [
    {
      "id": "D1",
      "question": "Que documentos pessoais são exigidos na admissão e onde ficam guardados?",
      "owner": "Responsável de Recursos Humanos",
      "status": "open",
      "raisedBy": "provia-workflow-designer",
      "sourceRefs": [
        {
          "source": "sop-admissao",
          "section": "1"
        }
      ]
    },
    {
      "id": "D-ACC",
      "question": "Quem abre um caso de admissão vê todos os casos do workflow enquanto não existirem regras por caso. Aceitar a limitação ou restringir quem abre?",
      "owner": "Director de Recursos Humanos",
      "status": "open",
      "raisedBy": "provia-workflow-designer",
      "sourceRefs": [
        {
          "source": "sop-admissao",
          "section": "1"
        }
      ]
    }
  ],
  "receipts": []
}
