{
  "schemaVersion": "provia-project/v1.1",
  "project": {
    "key": "two-approval-procedure",
    "title": "Two-approval procedure — exception review and change proposal",
    "language": "en",
    "country": "Angola (provisional — not supplied)",
    "timezone": "Africa/Luanda",
    "currency": "AOA",
    "generator": "provia-skills/provia-process-knowledge",
    "contractRevision": null,
    "updatedAt": "2026-09-21"
  },
  "organization": {
    "name": null,
    "sector": null,
    "mode": "disconnected",
    "tenantId": null,
    "productRevision": null
  },
  "sources": [
    {
      "id": "approved-procedure",
      "title": "Approved procedure requiring two approvals (document not supplied)",
      "kind": "sop",
      "version": null,
      "effectiveDate": null,
      "summary": "Known only from the request: the approved procedure requires two approvals before a case proceeds. Title, version, approving authority and text were not supplied.",
      "sections": []
    },
    {
      "id": "urgent-case",
      "title": "Urgent case that skipped both approvals (case record not supplied)",
      "kind": "other",
      "version": null,
      "effectiveDate": null,
      "summary": "Known only from the request: one urgent case proceeded without either approval. Case id, decision-maker, reason, ratification and outcome were not supplied.",
      "sections": []
    },
    {
      "id": "request-2026-09-21",
      "title": "Request to rewrite the procedure so the workaround becomes the normal process",
      "kind": "interview",
      "version": null,
      "effectiveDate": "2026-09-21",
      "summary": "Verbal request. Not applied: recorded as policy conflict D2 instead. See procedure-review.md section 1.",
      "sections": []
    }
  ],
  "entityTypes": [],
  "groups": [],
  "workflows": [],
  "forms": [],
  "aiProfiles": [],
  "decisions": [
    {
      "id": "D0",
      "question": "Which approved procedure (title, version, effective date, approving authority) and which Provia workflow version (key, the two Decision action ids, assignees) does this concern? The proposed action briefs in procedure-review.md section 6 cannot be attached to actions until this is known.",
      "owner": "Requester",
      "status": "open",
      "raisedBy": "provia-process-knowledge",
      "sourceRefs": [ { "source": "approved-procedure" } ]
    },
    {
      "id": "D1",
      "question": "Was the urgent case's skip of both approvals authorised by anyone with approval authority, before or after the fact, and was the deviation justified? The two approvers should record ratification or objection on the case now, independently of any procedure change.",
      "owner": "Process owner / policy authority for the procedure",
      "status": "open",
      "raisedBy": "provia-process-knowledge",
      "sourceRefs": [ { "source": "urgent-case" } ]
    },
    {
      "id": "D2",
      "question": "Policy conflict: the request asks to remove both approvals for every case; the approved procedure requires two. Does the policy authority (a) keep the procedure unchanged, (b) add an urgent path with one pre-approval and mandatory ratification (Option A), (c) add a logged emergency override with both approvals collected afterwards (Option B), or (d) withdraw the two-approval requirement? Option (d) was requested and is not recommended; only the policy authority can decide it.",
      "owner": "Policy authority for the procedure",
      "status": "open",
      "raisedBy": "provia-process-knowledge",
      "sourceRefs": [ { "source": "request-2026-09-21" }, { "source": "approved-procedure" } ]
    },
    {
      "id": "D3",
      "question": "If an urgent path is added (D2 b or c): what is the objective trigger for 'urgent', who may invoke it, and within what period must the deferred approval or ratification be recorded? Not invented; needed before the Exceptions clause of either approval brief can be finalised.",
      "owner": "Process owner",
      "status": "open",
      "raisedBy": "provia-process-knowledge",
      "sourceRefs": [ { "source": "approved-procedure" } ]
    },
    {
      "id": "D4",
      "question": "Administrator review of the proposed Agent Memory entry (procedure-review.md section 7): only the standing two-approval rule and the exception-recording rule are proposed; no urgent-path text until D2 is resolved.",
      "owner": "Provia administrator",
      "status": "open",
      "raisedBy": "provia-process-knowledge",
      "sourceRefs": [ { "source": "approved-procedure" } ]
    }
  ],
  "receipts": []
}
