{
  "schemaVersion": "provia-project/v1",
  "project": {
    "key": "pending-extra-approval",
    "title": "Add an extra approval to the live workflow",
    "language": "en",
    "country": "Angola",
    "timezone": "Africa/Luanda",
    "currency": "AOA",
    "generator": "provia-skills/1.1.0",
    "contractRevision": "2641364d9c1aa0aa2b76aa788ef521bcb6218118",
    "updatedAt": "2026-09-18"
  },
  "organization": {
    "name": null,
    "sector": null,
    "mode": "disconnected",
    "tenantId": null,
    "productRevision": null
  },
  "sources": [
    {
      "id": "change-request",
      "title": "Chat request: plan a new version with an extra approval without losing evidence from open cases",
      "kind": "other",
      "version": "1",
      "effectiveDate": "2026-09-18",
      "sections": []
    }
  ],
  "entityTypes": [],
  "groups": [],
  "workflows": [
    {
      "key": "target-workflow",
      "name": "Workflow to be identified (name pending)",
      "prefix": "TBD",
      "status": "change_planned",
      "sourceRefs": [ { "source": "change-request" } ],
      "actions": [
        {
          "localId": "extra-approval",
          "name": "Decide on the additional approval",
          "type": "decision",
          "sourceRefs": [ { "source": "change-request" } ],
          "assigneeRef": null,
          "formRef": null,
          "entityRefs": [],
          "evidence": [ "Comment required on any outcome other than approve (pending confirmation)" ],
          "due": null,
          "folded": []
        }
      ],
      "subWorkflowRefs": [],
      "setupNotes": [
        "Placeholder workflow. Replace key, name and prefix with the real live workflow before packaging.",
        "Position of the new decision in the sequence (before/after the existing approval, and the criterion that routes a case to it) is not yet defined; see decisions D3.",
        "No workflow.yaml exists yet for this key; start the real draft from workflow_export_yaml of the live version in connected mode, or from the current published YAML in disconnected mode."
      ]
    }
  ],
  "forms": [],
  "aiProfiles": [],
  "decisions": [
    {
      "id": "D1",
      "question": "Which live workflow (key, or its exported YAML) does this change apply to? No workflow design was supplied.",
      "owner": "Workflow owner",
      "status": "open",
      "raisedBy": "provia-workflow-change",
      "sourceRefs": [ { "source": "change-request" } ]
    },
    {
      "id": "D2",
      "question": "Can the current open incidents (case list with current action, instantiated field values and evidence already attached) be exported for inspection before publishing the new version? This impact check is pending; none of that evidence was supplied.",
      "owner": "Implementer",
      "status": "open",
      "raisedBy": "provia-workflow-change",
      "sourceRefs": [ { "source": "change-request" } ]
    },
    {
      "id": "D3",
      "question": "Who is the new approving group, and at which point in the sequence does the additional approval sit (before or after the existing approval, and on what criterion or threshold)?",
      "owner": "Process owner",
      "status": "open",
      "raisedBy": "provia-workflow-change",
      "sourceRefs": [ { "source": "change-request" } ]
    },
    {
      "id": "D4",
      "question": "Does the new approval need a new case field (for example, a threshold amount or justification)? If yes, will it stay optional so it cannot block an already-open incident whose current action still validates against workflow-level metadata?",
      "owner": "Implementer",
      "status": "open",
      "raisedBy": "provia-workflow-change",
      "sourceRefs": [ { "source": "change-request" } ]
    },
    {
      "id": "D5",
      "question": "What effective/publish date is intended for the new version, and how will the new approver group and existing assignees be notified before it goes live?",
      "owner": "Process owner",
      "status": "open",
      "raisedBy": "provia-workflow-change",
      "sourceRefs": [ { "source": "change-request" } ]
    }
  ],
  "receipts": []
}
