{
  "schemaVersion": "provia-project/v1",
  "project": {
    "key": "compras",
    "title": "Pedido de compra — revisão de controlos e evidências",
    "language": "pt-AO",
    "country": "Angola",
    "timezone": "Africa/Luanda",
    "currency": "AOA",
    "generator": "provia-skills/1.1.0",
    "contractRevision": null,
    "updatedAt": "2026-09-18"
  },
  "organization": {
    "name": "Empresa exemplo",
    "sector": "Serviços",
    "mode": "disconnected",
    "tenantId": null,
    "productRevision": null
  },
  "sources": [
    {
      "id": "politica-compras-cotacoes",
      "title": "Política interna de compras — duas cotações acima de 500.000 AOA",
      "kind": "policy",
      "version": null,
      "effectiveDate": null,
      "sections": []
    },
    {
      "id": "modelo-consultor-protecao-dados",
      "title": "Modelo de contrato de consultoria — cláusula de protecção de dados (cita a LGPD brasileira)",
      "kind": "other",
      "version": null,
      "effectiveDate": null,
      "sections": []
    }
  ],
  "entityTypes": [],
  "groups": [],
  "workflows": [],
  "forms": [],
  "aiProfiles": [],
  "decisions": [
    {
      "id": "D1",
      "question": "P1 (600.000 AOA) tem apenas uma cotação registada, acima do limiar interno de 500.000 AOA que exige duas. Regularizar o processo P1 (obter e anexar a segunda cotação ou registar e aprovar formalmente uma excepção) e, se o workflow não tiver uma acção que force o registo de duas cotações acima do limiar, adicionar essa validação.",
      "owner": "Responsável de Compras / Direcção Financeira",
      "status": "open",
      "raisedBy": "provia-controls-evidence",
      "sourceRefs": [
        { "source": "politica-compras-cotacoes" }
      ]
    },
    {
      "id": "D2",
      "question": "O modelo de contrato de consultoria cita a LGPD (Lei n.º 13.709/2018, Brasil), que não é a lei aplicável a um processo sediado em Angola. Substituir a cláusula por texto alinhado com o instrumento angolano de protecção de dados pessoais (a verificar em https://apd.ao/ao/legislacao/, incluindo número, estado em vigor, data de publicação e data de verificação), com validação jurídica antes de reutilizar o modelo.",
      "owner": "Jurídico / Encarregado de Protecção de Dados",
      "status": "open",
      "raisedBy": "provia-controls-evidence",
      "sourceRefs": [
        { "source": "modelo-consultor-protecao-dados" }
      ]
    }
  ],
  "receipts": []
}
