{
  "schemaVersion": "provia-project/v1.1",
  "project": {
    "key": "yaml-repair",
    "title": "Exported workflow YAML repair (input pending)",
    "language": "en",
    "country": "AO",
    "timezone": "Africa/Luanda",
    "currency": null,
    "generator": "provia-skills/1.2.0",
    "contractRevision": "fed8efaf019abc901cb2b229f3676dc4031126fa",
    "updatedAt": "2026-09-21"
  },
  "organization": {
    "name": null,
    "sector": null,
    "mode": "disconnected",
    "tenantId": null,
    "productRevision": null,
    "language": null,
    "timezone": null
  },
  "sources": [],
  "entityTypes": [],
  "groups": [],
  "workflows": [],
  "forms": [],
  "receipts": [],
  "decisions": [
    {
      "id": "D1",
      "question": "Supply the exported workflow YAML to repair. The working directory contained no .yaml/.yml/.zip file and no manifest; nothing could be parsed, validated or repaired.",
      "owner": "Requester (lisboa@pixel.ao)",
      "status": "open",
      "raisedBy": "provia-workflow-package"
    },
    {
      "id": "D2",
      "question": "Confirm the intended approval process (approver per step, rejection outcomes, return targets) so the repair can be checked against it. Without the export or a design, the process is unknown and must not be reconstructed from assumptions.",
      "owner": "Process owner (to be named)",
      "status": "open",
      "raisedBy": "provia-workflow-package"
    },
    {
      "id": "D3",
      "question": "Provide the destination group ids (receipts) for every approver/assignee, or accept a draft whose assignees are omitted and listed in setup.md. Fabricated UUIDs will not be written.",
      "owner": "Provia organization administrator",
      "status": "open",
      "raisedBy": "provia-workflow-package"
    },
    {
      "id": "D4",
      "question": "Either authorize the Provia connector (org_get_context / workflow_export_yaml were offered by the host but the call was not permitted in this session) or paste/attach the export manually.",
      "owner": "Requester (lisboa@pixel.ao)",
      "status": "open",
      "raisedBy": "provia-workflow-package"
    },
    {
      "id": "D5",
      "question": "Confirm country and language for the repaired package. Angola / en were used provisionally because none was supplied.",
      "owner": "Requester (lisboa@pixel.ao)",
      "status": "open",
      "raisedBy": "provia-workflow-package"
    }
  ]
}
