{
  "schemaVersion": "provia-project/v1.1",
  "project": {
    "key": "compras",
    "title": "Pedido de compra",
    "language": "pt-AO",
    "country": "Angola",
    "timezone": "Africa/Luanda",
    "currency": "AOA",
    "generator": "provia-skills/1.2.0",
    "contractRevision": "fed8efaf019abc901cb2b229f3676dc4031126fa",
    "updatedAt": "2026-09-21"
  },
  "organization": {
    "name": "Organização a confirmar",
    "sector": null,
    "mode": "disconnected",
    "tenantId": null,
    "productRevision": null
  },
  "sources": [
    {
      "id": "sop-compras",
      "title": "Procedimento de compras — desenho aprovado (não fornecido nesta sessão; estrutura tomada do exemplo de compras incluído no plugin)",
      "kind": "sop",
      "version": "1",
      "effectiveDate": null,
      "sections": [
        { "anchor": "1", "title": "Pedido" },
        { "anchor": "2", "title": "Aprovação pela chefia" },
        { "anchor": "3", "title": "Cabimento orçamental" },
        { "anchor": "4", "title": "Encomenda ao fornecedor" }
      ]
    }
  ],
  "entityTypes": [],
  "groups": [
    {
      "key": "chefias",
      "name": "Chefias de departamento",
      "parentKey": null,
      "purpose": "Aprovam os pedidos de compra do seu departamento.",
      "members": [
        { "role": "Chefe de departamento", "email": null }
      ],
      "sourceRefs": [
        { "source": "sop-compras", "section": "2" }
      ],
      "flags": [
        {
          "code": "segregation",
          "detail": "A chefia não pode aprovar pedidos que ela própria registou; confirmar com o dono do processo."
        }
      ],
      "kind": "team",
      "area": "gestao_corporativa"
    },
    {
      "key": "financas",
      "name": "Finanças",
      "parentKey": null,
      "purpose": "Confirmam o cabimento orçamental.",
      "members": [
        { "role": "Técnico de orçamento", "email": null }
      ],
      "sourceRefs": [
        { "source": "sop-compras", "section": "3" }
      ],
      "flags": [],
      "kind": "team",
      "area": "gestao_corporativa"
    },
    {
      "key": "compras",
      "name": "Compras",
      "parentKey": null,
      "purpose": "Emitem as encomendas e mantêm o registo de fornecedores.",
      "members": [
        { "role": "Técnico de compras", "email": null }
      ],
      "sourceRefs": [
        { "source": "sop-compras", "section": "4" }
      ],
      "flags": [],
      "kind": "team",
      "area": "gestao_corporativa"
    }
  ],
  "workflows": [
    {
      "key": "compras",
      "name": "Pedido de compra",
      "prefix": "COMP",
      "file": "workflow.yaml",
      "status": "validated",
      "ownerArea": "gestao_corporativa",
      "sourceRefs": [
        { "source": "sop-compras" }
      ],
      "triggers": [
        { "type": "manual", "label": "Iniciar pedido de compra", "enabled": true }
      ],
      "actions": [
        {
          "localId": "registar",
          "name": "Registar a necessidade",
          "type": "standard",
          "sourceRefs": [
            { "source": "sop-compras", "section": "1" }
          ],
          "assigneeRef": "creator",
          "formRef": null,
          "entityRefs": [],
          "evidence": [
            "Título, montante e centro de custo preenchidos",
            "Proposta anexada quando existir"
          ],
          "due": { "offsetDays": 1, "offsetType": "workdays", "basis": "activation" },
          "folded": []
        },
        {
          "localId": "decidir",
          "name": "Decidir sobre o pedido",
          "type": "decision",
          "sourceRefs": [
            { "source": "sop-compras", "section": "2" }
          ],
          "assigneeRef": "chefias",
          "formRef": null,
          "entityRefs": [],
          "evidence": [
            "Comentário obrigatório em Devolver e Rejeitar"
          ],
          "due": { "offsetDays": 2, "offsetType": "workdays", "basis": "activation" },
          "folded": [
            {
              "section": "2",
              "summary": "O requerente é informado da decisão pelo próprio caso; não é uma acção separada."
            }
          ]
        },
        {
          "localId": "confirmar_cabimento",
          "name": "Confirmar disponibilidade orçamental",
          "type": "standard",
          "sourceRefs": [
            { "source": "sop-compras", "section": "3" }
          ],
          "assigneeRef": "financas",
          "formRef": null,
          "entityRefs": [],
          "evidence": [
            "Captura do saldo com data",
            "Campo budget_reference preenchido"
          ],
          "due": { "offsetDays": 2, "offsetType": "workdays", "basis": "activation" },
          "folded": []
        },
        {
          "localId": "encomendar",
          "name": "Registar a encomenda",
          "type": "standard",
          "sourceRefs": [
            { "source": "sop-compras", "section": "4" }
          ],
          "assigneeRef": "compras",
          "formRef": null,
          "entityRefs": [],
          "evidence": [
            "Nota de encomenda anexada",
            "Campo order_reference preenchido"
          ],
          "due": { "offsetDays": 3, "offsetType": "workdays", "basis": "activation" },
          "folded": [
            {
              "section": "4",
              "summary": "Confirmar os dados do fornecedor antes de emitir a nota."
            }
          ]
        }
      ],
      "subWorkflowRefs": [],
      "setupNotes": [
        "O YAML atribui apenas a acção «Registar a necessidade» ao criador. As acções «Decidir sobre o pedido», «Confirmar disponibilidade orçamental» e «Registar a encomenda» não têm responsável no ficheiro porque os grupos ainda não existem no destino; atribuí-los no Provia depois de criar os grupos, sem substituir pelo criador.",
        "O registo de fornecedores (tipo de entidade) não faz parte deste pacote; se a organização o quiser associado ao pedido, definir o tipo com provia-information-model e configurar a associação no Provia após a importação.",
        "Os prazos (1, 2, 2 e 3 dias úteis) e os limites de aprovação são o desenho de referência, não regras legais nem política confirmada pelo cliente; confirmar antes de publicar."
      ],
      "access": {
        "grants": [
          {
            "grantee": "organization",
            "level": "create_incident",
            "reason": "Qualquer colaborador regista um pedido de compra para o seu departamento",
            "sourceRefs": [
              { "source": "sop-compras", "section": "1" }
            ]
          },
          {
            "grantee": "group:compras",
            "level": "view",
            "reason": "A equipa de Compras acompanha todos os pedidos em curso para planear as encomendas",
            "sourceRefs": [
              { "source": "sop-compras", "section": "4" }
            ]
          }
        ],
        "sensitivity": "internal"
      }
    }
  ],
  "forms": [],
  "aiProfiles": [],
  "decisions": [
    {
      "id": "D1",
      "question": "Qual é o limite de autoridade das chefias e quem aprova acima dele?",
      "owner": "Director financeiro",
      "status": "open",
      "raisedBy": "provia-workflow-designer",
      "sourceRefs": [
        { "source": "sop-compras", "section": "2" }
      ]
    },
    {
      "id": "D2",
      "question": "Pode a chefia aprovar um pedido que ela própria registou?",
      "owner": "Dono do processo",
      "status": "open",
      "raisedBy": "provia-organization-rollout",
      "sourceRefs": [
        { "source": "sop-compras", "section": "2" }
      ]
    },
    {
      "id": "D3",
      "question": "O desenho aprovado do pedido de compra não foi fornecido nesta sessão; o YAML segue o desenho de referência do plugin (4 acções, 3 grupos). Confirmar que corresponde ao procedimento aprovado pelo cliente ou fornecer o procedimento para regenerar o pacote.",
      "owner": "Dono do processo",
      "status": "open",
      "raisedBy": "provia-workflow-package",
      "sourceRefs": [
        { "source": "sop-compras" }
      ]
    }
  ],
  "receipts": []
}
